[
  {
    "کد": "ONL-001",
    "ساحت": "کالبدی–زیرساختی",
    "ردیف‌های شاخص مادر": "21,22",
    "شاخص‌های مادر در فهرست ۴۱۹‌گانه": "عوامل جغرافیایی؛ محدودیت زمین",
    "دسته‌های مادر": "کالبدی",
    "شاخص عملیاتی برخط": "میانگین و میانه ارتفاع",
    "نوع انطباق": "مستقیم",
    "نقش در گونه‌بندی": "تفکیک زمینه توپوگرافی",
    "مقیاس استفاده": "محله‌ای اصلی",
    "واحد": "متر",
    "ورودی/باند لازم": "DEM",
    "شیوه محاسبه": "میانگین/میانه ارتفاع تمام سلول‌های معتبر در مرز محله.",
    "جهت تفسیر": "خنثی/زمینه‌ای",
    "منبع": "Copernicus DEM GLO‑30",
    "تولیدکننده": "Copernicus / ESA",
    "شناسه مجموعه‌داده": "COPERNICUS/DEM/GLO30_2024_1",
    "لینک منبع": "https://developers.google.com/earth-engine/datasets/catalog/COPERNICUS_DEM_GLO30_2024_1",
    "تفکیک مکانی": "۳۰ متر",
    "پوشش زمانی": "ایستا؛ انتشار 2024_1",
    "روش دسترسی": "Copernicus / OpenTopography / Google Earth Engine",
    "پوشش ایران": "جهانی؛ شامل سراسر ایران",
    "هندسه تجمیع": "مرز محله؛ برای نقطه بافر متناسب با تفکیک منبع",
    "کنترل کیفیت اجباری": "شیب و مساحت در CRS متریک محلی؛ حفره‌ها/آب‌ها کنترل؛ DSM است و در بافت متراکم اثر بنا دارد.",
    "محدودیت/توضیح": "",
    "اطمینان پوشش و بازتولید": "۱۰۰٪ برای وجود منبع و امکان محاسبه در محدوده ایران؛ نه تضمین صحت مطلق یا حقیقت زمینی",
    "تاریخ کنترل منبع": "۲۰۲۶-۰۸-۱۸"
  },
  {
    "کد": "ONL-002",
    "ساحت": "کالبدی–زیرساختی",
    "ردیف‌های شاخص مادر": "21,22,143",
    "شاخص‌های مادر در فهرست ۴۱۹‌گانه": "عوامل جغرافیایی؛ محدودیت زمین؛ زمین مسطح برای بازی و ورزش",
    "دسته‌های مادر": "کالبدی؛ محدوده‌های سبز",
    "شاخص عملیاتی برخط": "میانگین شیب زمین",
    "نوع انطباق": "مستقیم",
    "نقش در گونه‌بندی": "تمایز قابلیت توسعه و دسترسی",
    "مقیاس استفاده": "محله‌ای اصلی",
    "واحد": "درجه",
    "ورودی/باند لازم": "DEM → slope",
    "شیوه محاسبه": "شیب از DEM در CRS متریک؛ سپس میانگین مساحت‌وزن‌دار.",
    "جهت تفسیر": "کمتر معمولاً مناسب‌تر",
    "منبع": "Copernicus DEM GLO‑30",
    "تولیدکننده": "Copernicus / ESA",
    "شناسه مجموعه‌داده": "COPERNICUS/DEM/GLO30_2024_1",
    "لینک منبع": "https://developers.google.com/earth-engine/datasets/catalog/COPERNICUS_DEM_GLO30_2024_1",
    "تفکیک مکانی": "۳۰ متر",
    "پوشش زمانی": "ایستا؛ انتشار 2024_1",
    "روش دسترسی": "Copernicus / OpenTopography / Google Earth Engine",
    "پوشش ایران": "جهانی؛ شامل سراسر ایران",
    "هندسه تجمیع": "مرز محله؛ برای نقطه بافر متناسب با تفکیک منبع",
    "کنترل کیفیت اجباری": "شیب و مساحت در CRS متریک محلی؛ حفره‌ها/آب‌ها کنترل؛ DSM است و در بافت متراکم اثر بنا دارد.",
    "محدودیت/توضیح": "",
    "اطمینان پوشش و بازتولید": "۱۰۰٪ برای وجود منبع و امکان محاسبه در محدوده ایران؛ نه تضمین صحت مطلق یا حقیقت زمینی",
    "تاریخ کنترل منبع": "۲۰۲۶-۰۸-۱۸"
  },
  {
    "کد": "ONL-003",
    "ساحت": "کالبدی–زیرساختی",
    "ردیف‌های شاخص مادر": "22",
    "شاخص‌های مادر در فهرست ۴۱۹‌گانه": "محدودیت زمین",
    "دسته‌های مادر": "کالبدی",
    "شاخص عملیاتی برخط": "سهم اراضی پرشیب",
    "نوع انطباق": "مستقیم",
    "نقش در گونه‌بندی": "محدودیت کالبدی/هزینه توسعه",
    "مقیاس استفاده": "محله‌ای اصلی",
    "واحد": "درصد",
    "ورودی/باند لازم": "شیب DEM",
    "شیوه محاسبه": "۱۰۰ × مساحت سلول‌های شیب ≥۱۵° ÷ مساحت خشکی محله.",
    "جهت تفسیر": "کمتر بهتر",
    "منبع": "Copernicus DEM GLO‑30",
    "تولیدکننده": "Copernicus / ESA",
    "شناسه مجموعه‌داده": "COPERNICUS/DEM/GLO30_2024_1",
    "لینک منبع": "https://developers.google.com/earth-engine/datasets/catalog/COPERNICUS_DEM_GLO30_2024_1",
    "تفکیک مکانی": "۳۰ متر",
    "پوشش زمانی": "ایستا؛ انتشار 2024_1",
    "روش دسترسی": "Copernicus / OpenTopography / Google Earth Engine",
    "پوشش ایران": "جهانی؛ شامل سراسر ایران",
    "هندسه تجمیع": "مرز محله؛ برای نقطه بافر متناسب با تفکیک منبع",
    "کنترل کیفیت اجباری": "شیب و مساحت در CRS متریک محلی؛ حفره‌ها/آب‌ها کنترل؛ DSM است و در بافت متراکم اثر بنا دارد.",
    "محدودیت/توضیح": "",
    "اطمینان پوشش و بازتولید": "۱۰۰٪ برای وجود منبع و امکان محاسبه در محدوده ایران؛ نه تضمین صحت مطلق یا حقیقت زمینی",
    "تاریخ کنترل منبع": "۲۰۲۶-۰۸-۱۸"
  },
  {
    "کد": "ONL-004",
    "ساحت": "کالبدی–زیرساختی",
    "ردیف‌های شاخص مادر": "143,22",
    "شاخص‌های مادر در فهرست ۴۱۹‌گانه": "زمین مسطح برای بازی و ورزش؛ محدودیت زمین",
    "دسته‌های مادر": "محدوده‌های سبز؛ کالبدی",
    "شاخص عملیاتی برخط": "سهم زمین مسطح قابل استفاده",
    "نوع انطباق": "عملیاتی‌سازی معتبر",
    "نقش در گونه‌بندی": "ظرفیت فضای باز و توسعه",
    "مقیاس استفاده": "محله‌ای اصلی",
    "واحد": "درصد",
    "ورودی/باند لازم": "شیب DEM + ماسک آب/ساخت",
    "شیوه محاسبه": "۱۰۰ × مساحت غیرآبی و غیرساخته با شیب ≤۵° ÷ مساحت محله.",
    "جهت تفسیر": "بیشتر بهتر",
    "منبع": "Copernicus DEM GLO‑30",
    "تولیدکننده": "Copernicus / ESA",
    "شناسه مجموعه‌داده": "COPERNICUS/DEM/GLO30_2024_1",
    "لینک منبع": "https://developers.google.com/earth-engine/datasets/catalog/COPERNICUS_DEM_GLO30_2024_1",
    "تفکیک مکانی": "۳۰ متر",
    "پوشش زمانی": "ایستا؛ انتشار 2024_1",
    "روش دسترسی": "Copernicus / OpenTopography / Google Earth Engine",
    "پوشش ایران": "جهانی؛ شامل سراسر ایران",
    "هندسه تجمیع": "مرز محله؛ برای نقطه بافر متناسب با تفکیک منبع",
    "کنترل کیفیت اجباری": "شیب و مساحت در CRS متریک محلی؛ حفره‌ها/آب‌ها کنترل؛ DSM است و در بافت متراکم اثر بنا دارد.",
    "محدودیت/توضیح": "",
    "اطمینان پوشش و بازتولید": "۱۰۰٪ برای وجود منبع و امکان محاسبه در محدوده ایران؛ نه تضمین صحت مطلق یا حقیقت زمینی",
    "تاریخ کنترل منبع": "۲۰۲۶-۰۸-۱۸"
  },
  {
    "کد": "ONL-005",
    "ساحت": "کالبدی–زیرساختی",
    "ردیف‌های شاخص مادر": "21,22",
    "شاخص‌های مادر در فهرست ۴۱۹‌گانه": "عوامل جغرافیایی؛ محدودیت زمین",
    "دسته‌های مادر": "کالبدی",
    "شاخص عملیاتی برخط": "ناهمواری توپوگرافی (TRI)",
    "نوع انطباق": "مستقیم",
    "نقش در گونه‌بندی": "تفکیک محلات دشوارگذر",
    "مقیاس استفاده": "محله‌ای اصلی",
    "واحد": "متر",
    "ورودی/باند لازم": "DEM؛ اختلاف همسایگی ۳×۳",
    "شیوه محاسبه": "میانگین TRI؛ ریشه میانگین مربع اختلاف ارتفاع پیکسل مرکزی و ۸ همسایه.",
    "جهت تفسیر": "کمتر معمولاً بهتر",
    "منبع": "Copernicus DEM GLO‑30",
    "تولیدکننده": "Copernicus / ESA",
    "شناسه مجموعه‌داده": "COPERNICUS/DEM/GLO30_2024_1",
    "لینک منبع": "https://developers.google.com/earth-engine/datasets/catalog/COPERNICUS_DEM_GLO30_2024_1",
    "تفکیک مکانی": "۳۰ متر",
    "پوشش زمانی": "ایستا؛ انتشار 2024_1",
    "روش دسترسی": "Copernicus / OpenTopography / Google Earth Engine",
    "پوشش ایران": "جهانی؛ شامل سراسر ایران",
    "هندسه تجمیع": "مرز محله؛ برای نقطه بافر متناسب با تفکیک منبع",
    "کنترل کیفیت اجباری": "شیب و مساحت در CRS متریک محلی؛ حفره‌ها/آب‌ها کنترل؛ DSM است و در بافت متراکم اثر بنا دارد.",
    "محدودیت/توضیح": "",
    "اطمینان پوشش و بازتولید": "۱۰۰٪ برای وجود منبع و امکان محاسبه در محدوده ایران؛ نه تضمین صحت مطلق یا حقیقت زمینی",
    "تاریخ کنترل منبع": "۲۰۲۶-۰۸-۱۸"
  },
  {
    "کد": "ONL-006",
    "ساحت": "کالبدی–زیرساختی",
    "ردیف‌های شاخص مادر": "21",
    "شاخص‌های مادر در فهرست ۴۱۹‌گانه": "عوامل جغرافیایی",
    "دسته‌های مادر": "کالبدی",
    "شاخص عملیاتی برخط": "دامنه ارتفاع محلی",
    "نوع انطباق": "مستقیم",
    "نقش در گونه‌بندی": "زمینه ناهمواری",
    "مقیاس استفاده": "محله‌ای اصلی",
    "واحد": "متر",
    "ورودی/باند لازم": "DEM",
    "شیوه محاسبه": "صدک ۹۵ ارتفاع منهای صدک ۵ ارتفاع در محله.",
    "جهت تفسیر": "خنثی/زمینه‌ای",
    "منبع": "Copernicus DEM GLO‑30",
    "تولیدکننده": "Copernicus / ESA",
    "شناسه مجموعه‌داده": "COPERNICUS/DEM/GLO30_2024_1",
    "لینک منبع": "https://developers.google.com/earth-engine/datasets/catalog/COPERNICUS_DEM_GLO30_2024_1",
    "تفکیک مکانی": "۳۰ متر",
    "پوشش زمانی": "ایستا؛ انتشار 2024_1",
    "روش دسترسی": "Copernicus / OpenTopography / Google Earth Engine",
    "پوشش ایران": "جهانی؛ شامل سراسر ایران",
    "هندسه تجمیع": "مرز محله؛ برای نقطه بافر متناسب با تفکیک منبع",
    "کنترل کیفیت اجباری": "شیب و مساحت در CRS متریک محلی؛ حفره‌ها/آب‌ها کنترل؛ DSM است و در بافت متراکم اثر بنا دارد.",
    "محدودیت/توضیح": "",
    "اطمینان پوشش و بازتولید": "۱۰۰٪ برای وجود منبع و امکان محاسبه در محدوده ایران؛ نه تضمین صحت مطلق یا حقیقت زمینی",
    "تاریخ کنترل منبع": "۲۰۲۶-۰۸-۱۸"
  },
  {
    "کد": "ONL-007",
    "ساحت": "کالبدی–زیرساختی",
    "ردیف‌های شاخص مادر": "65,66,68",
    "شاخص‌های مادر در فهرست ۴۱۹‌گانه": "وضعیت دفع آب سطحی و مخازن زباله؛ فقدان سیستم مناسب دفع و هدایت آب‌های سطحی؛ نبود سیستم فاضلاب مناسب و جمع شدن آب‌های سطحی در معابر",
    "دسته‌های مادر": "زیست محیطی",
    "شاخص عملیاتی برخط": "سهم مسیرهای تمرکز رواناب",
    "نوع انطباق": "پروکسی شفاف",
    "نقش در گونه‌بندی": "غربالگری آب‌گرفتگی",
    "مقیاس استفاده": "محله‌ای اصلی",
    "واحد": "درصد",
    "ورودی/باند لازم": "DEM هیدرولوژیک؛ flow accumulation",
    "شیوه محاسبه": "پس از fill sinks، تجمع جریان محاسبه؛ سهم سلول‌های بالاتر از صدک ۹۵ حوضه محلی گزارش شود.",
    "جهت تفسیر": "بیشتر = ریسک بالاتر",
    "منبع": "Copernicus DEM GLO‑30",
    "تولیدکننده": "Copernicus / ESA",
    "شناسه مجموعه‌داده": "COPERNICUS/DEM/GLO30_2024_1",
    "لینک منبع": "https://developers.google.com/earth-engine/datasets/catalog/COPERNICUS_DEM_GLO30_2024_1",
    "تفکیک مکانی": "۳۰ متر",
    "پوشش زمانی": "ایستا؛ انتشار 2024_1",
    "روش دسترسی": "Copernicus / OpenTopography / Google Earth Engine",
    "پوشش ایران": "جهانی؛ شامل سراسر ایران",
    "هندسه تجمیع": "مرز محله؛ برای نقطه بافر متناسب با تفکیک منبع",
    "کنترل کیفیت اجباری": "شیب و مساحت در CRS متریک محلی؛ حفره‌ها/آب‌ها کنترل؛ DSM است و در بافت متراکم اثر بنا دارد.",
    "محدودیت/توضیح": "زیرساخت دفع آب را اندازه نمی‌گیرد؛ فقط استعداد توپوگرافی را نشان می‌دهد.",
    "اطمینان پوشش و بازتولید": "۱۰۰٪ برای وجود منبع و امکان محاسبه در محدوده ایران؛ نه تضمین صحت مطلق یا حقیقت زمینی",
    "تاریخ کنترل منبع": "۲۰۲۶-۰۸-۱۸"
  },
  {
    "کد": "ONL-008",
    "ساحت": "کالبدی–زیرساختی",
    "ردیف‌های شاخص مادر": "66,68",
    "شاخص‌های مادر در فهرست ۴۱۹‌گانه": "فقدان سیستم مناسب دفع و هدایت آب‌های سطحی؛ نبود سیستم فاضلاب مناسب و جمع شدن آب‌های سطحی در معابر",
    "دسته‌های مادر": "زیست محیطی",
    "شاخص عملیاتی برخط": "عمق سیلاب رودخانه‌ای با دوره بازگشت ۱۰۰ سال",
    "نوع انطباق": "عملیاتی‌سازی معتبر",
    "نقش در گونه‌بندی": "ریسک سیلاب",